ks;Какой стык называют гарантийным?;3;3;стык, выполненный сварщиком с допуском, в особо ответственном месте трубопровода;стык, на который предусмотрена специальная технология сварки;стык, который не подвергался гидравлическим испытаниям
ot;ВГУ устанавливают в газопроводе на расстоянии от места производства работ:;2;3;10-12 метров;8-10 метров;6-8 метров
gpa;В каком состоянии должны находиться двери воздухозаборных камер на работающих ГПА?;3;3;закрыты на замок;открыты для предотвращения обледенения очистных устройств;закрыты и опломбированы
bptpg;Что происходит с параметрами топливного газа при прохождении через регулятор РДУ-80?;2;3;давление падает, температура растёт, скорость растёт;давление падает, температура падает, скорость растёт;давление растёт, температура растёт, скорость падает
ks;Укажите правильное определение понятия "Коммерческий расход газа";3;3;суточный расход газа, необходимый для продажи потребителям;объемный расход газа через нагнетатель по условиям всасывания;суточный расход газа, приведенный к стандартным условиям
kip;В чём измеряется виброскорость?;1;3;м/с;мм;м/с2
